{
  "schema_version": "1.0",
  "live_state_id": "provider-live-state:synthetic-alpha",
  "provider_profile_id": "provider-profile:synthetic-alpha",
  "provider_child_id": "STUDIO-009P-99",
  "offline_merge_ref": "merge:offline-synthetic",
  "offline_qa_ref": "qa:offline-synthetic",
  "offline_review_ref": "review:offline-synthetic",
  "offline_owner_merge_ref": "owner-merge:offline-synthetic",
  "v_contract_ref": null,
  "connected_validation_ref": null,
  "routing_authority_ref": null,
  "state": "LIVE_VALIDATION_READY",
  "allowed_data_classifications": [
    "PUBLIC"
  ],
  "money_ceiling": 0,
  "paused_at": null,
  "revoked_at": null,
  "as_of": "2026-09-04T10:00:00Z",
  "canonical_digest": "sha256:8725be6226a0376e5ac659901bb65fd67c6d53ecd5aa41d9f2a61c250258f5c9"
}
